{"authority":"ONE_CALLER_PINNED_BOUNDED_SINGLE_SCRIPT_SAME_RUN_EVIDENCE_ONLY_NOT_SCRIPT_SAFETY_CAPTURE_COMPLETENESS_RUNTIME_ATTESTATION_ISOLATION_BACKEND_QUALIFICATION_ADMISSION_OR_PHASE2_EXIT_AUTHORITY","capability_diff_receipt_digest":"sha256:724db9924445aabc2cf9c52d11e57cc2771680f93d73ffb7872479af8540049b","captured_at":"2026-08-03T02:32:29Z","entrypoint":{"container_path":"/aragorn-input/run.sh","digest":"sha256:d03f305f503fd161eca9916a781aa060708ec12fe64d83660e4a56c5e7643894","executable":true,"path":"scripts/check.sh","size":89},"evidence":{"artifact_source":"sha256:b50bc6351887a238da7a8863edf061fa7ce86ab628ce206aea50a9722023ff63","backend_log_manifest":"sha256:2a4944d1e4d90e80d2fc18e7f858447af3b11e2c7d388601b3b372dade466afb","container_cleanup":"sha256:2e359a22a612c9e660e6dab9b40ae933e89f449c316fd375f43c3a391803d992","container_live_inspect":"sha256:02877f25b8a1ff3b93def2a8bff9d909b73d4dadf7379bcff302ca8c93b20a51","container_post_inspect":"sha256:c6f1f8674a08290f35a941c5abbec177c285eca10aa0e42ba762471f0f271ab7","container_pre_inspect":"sha256:e6d0c2fb6bdbe9eee464300163c8b3420572ff40b3188141b33201c0a8030fbe","container_processes":"sha256:ffde30f1f51b4b2f3d659ce9b4af69a1217a24d7ea01b5ed30110d39a5d602f0","container_stderr":"sha256:e3b0c44298fc1c149afbf4c8996fb92427ae41e4649b934ca495991b7852b855","container_stdout":"sha256:e3b0c44298fc1c149afbf4c8996fb92427ae41e4649b934ca495991b7852b855","daemon_config":"sha256:524100d9568a3bd3bdd3fede8596b9f94d79866528bbe3d9af1ae6e394876330","docker_executable":"sha256:4a930d4c71679fbdc1e187838426be88eb5c605021d7b7ef2149f896c11d2935","helper_implementations":"sha256:a77fe5a2f3c3c54f7113fc53b557883cce8c7dc5e8d2f2df0fa1402627834c70","image_inspect":"sha256:a49c6fd1dab130865b26b8d1e7a8d99325edaef9fd74e87f7c7c0ea907ad88d6","installed_binaries":"sha256:666898f9bdd2361a3bd9d50a612fbf5e361fdb825a5a38340a80fa420d6ea3b3","runner_post":"sha256:be2374c1c00790600599e6955f25c24b1fa45e9db543ea5724a29de663a5df89","runner_pre":"sha256:be2374c1c00790600599e6955f25c24b1fa45e9db543ea5724a29de663a5df89","runtime_registration":"sha256:b45294798dfcb9f716638b5f06b424e29d75dacae57cdad01b145156b71e4172","runtime_version":"sha256:04bbc2477dfa4e780666aec3755f3f172a10783a97fdb2c3916c571fca91bacc"},"execution_profile":"bounded-single-script/v1","gateway_profile_digest":"sha256:485557f9dcd31329c9ec769fc89e81d2ca2c969b747f1316c1144058faadf798","implementation_digest":"sha256:7f93a227e53b893061be6f1c74d503881a7d26b06fc7990946ca419b18831d27","input_manifest_digest":"sha256:5bf379b9493eafc2841d619622a38677c968350f1bceadaa5acb00b6b6a43ad3","input_tree_digest":"sha256:34e32015fc62a024af75ca59e2a273b6884e496dabaaf3eb9fb00883e27c447f","lock_digest":"sha256:70556d2b8ae0d30f199f5bd6d7df2c1df11071a9b61120954f9b76f6870839ed","normalization_profile":"successful-openat-execve-set/v1","normalizer_implementation_digest":"sha256:7f93a227e53b893061be6f1c74d503881a7d26b06fc7990946ca419b18831d27","quarantine_receipt_digest":"sha256:094c9b4541a02e046df6e15a789026f255df2b803f9482e72c9ce7ed6c63ea1a","run_id":"0b6ec3ea4b469e9f0ad26728a8711ecf","run_request_digest":"sha256:1fd73c8b8ca810e912f9b89e1fc955ae3a997636a6807809ae7a0848dd355563","runtime_lock_digest":"sha256:f56bfc3e06e26e682c609d51811edf341d3f688b67f13104883265f515efe602","schema":"aragorn/gvisor-acquired-artifact-receipt/v3","source_closure_digest":"sha256:3052a8e1e77e377427b1992d2eea1a45e719ae82bea95ec9a1c0dc4bce2e2237","status":"RECORDED","subject_digest":"sha256:34e32015fc62a024af75ca59e2a273b6884e496dabaaf3eb9fb00883e27c447f"}